[
  {
    "schema_version": "bod.pose.v1",
    "body_profile": "classic31_v1",
    "calibration_id": "cal-classic31-nixie-fullstart-defaults-v0",
    "pose_id": "BP1-ddcab2230df85dcc",
    "pose_name": "rest",
    "joint_vector": [
      {
        "name": "rightHand.thumb",
        "svo": [
          "SVO01"
        ],
        "q_deg": 0,
        "commanded_deg": 2,
        "estimated_deg": 2,
        "sensed_deg": null,
        "provenance": "estimated",
        "confidence": 0.6,
        "status": "ok",
        "energized": false
      },
      {
        "name": "rightHand.index",
        "svo": [
          "SVO02"
        ],
        "q_deg": 0,
        "commanded_deg": 2,
        "estimated_deg": 2,
        "sensed_deg": null,
        "provenance": "estimated",
        "confidence": 0.6,
        "status": "ok",
        "energized": false
      },
      {
        "name": "rightHand.majeure",
        "svo": [
          "SVO03"
        ],
        "q_deg": 0,
        "commanded_deg": 2,
        "estimated_deg": 2,
        "sensed_deg": null,
        "provenance": "estimated",
        "confidence": 0.6,
        "status": "ok",
        "energized": false
      },
      {
        "name": "rightHand.ringFinger",
        "svo": [
          "SVO04"
        ],
        "q_deg": 0,
        "commanded_deg": 2,
        "estimated_deg": 2,
        "sensed_deg": null,
        "provenance": "estimated",
        "confidence": 0.6,
        "status": "ok",
        "energized": false
      },
      {
        "name": "rightHand.pinky",
        "svo": [
          "SVO05"
        ],
        "q_deg": 0,
        "commanded_deg": 2,
        "estimated_deg": 2,
        "sensed_deg": null,
        "provenance": "estimated",
        "confidence": 0.6,
        "status": "ok",
        "energized": false
      },
      {
        "name": "rightHand.wrist",
        "svo": [
          "SVO06"
        ],
        "q_deg": 90,
        "commanded_deg": 90,
        "estimated_deg": 90,
        "sensed_deg": null,
        "provenance": "estimated",
        "confidence": 0.6,
        "status": "ok",
        "energized": false
      },
      {
        "name": "rightArm.bicep",
        "svo": [
          "SVO07"
        ],
        "q_deg": 0,
        "commanded_deg": 0,
        "estimated_deg": 0,
        "sensed_deg": null,
        "provenance": "estimated",
        "confidence": 0.6,
        "status": "ok",
        "energized": true
      },
      {
        "name": "rightArm.rotate",
        "svo": [
          "SVO08"
        ],
        "q_deg": 90,
        "commanded_deg": 90,
        "estimated_deg": 90,
        "sensed_deg": null,
        "provenance": "estimated",
        "confidence": 0.6,
        "status": "ok",
        "energized": false
      },
      {
        "name": "rightArm.shoulder",
        "svo": [
          "SVO09"
        ],
        "q_deg": 30,
        "commanded_deg": 30,
        "estimated_deg": 30,
        "sensed_deg": null,
        "provenance": "estimated",
        "confidence": 0.6,
        "status": "ok",
        "energized": true
      },
      {
        "name": "rightArm.omoplate",
        "svo": [
          "SVO10"
        ],
        "q_deg": 10,
        "commanded_deg": 10,
        "estimated_deg": 10,
        "sensed_deg": null,
        "provenance": "estimated",
        "confidence": 0.6,
        "status": "ok",
        "energized": true
      },
      {
        "name": "leftHand.thumb",
        "svo": [
          "SVO11"
        ],
        "q_deg": 0,
        "commanded_deg": 2,
        "estimated_deg": 2,
        "sensed_deg": null,
        "provenance": "estimated",
        "confidence": 0.6,
        "status": "ok",
        "energized": false
      },
      {
        "name": "leftHand.index",
        "svo": [
          "SVO12"
        ],
        "q_deg": 0,
        "commanded_deg": 2,
        "estimated_deg": 2,
        "sensed_deg": null,
        "provenance": "estimated",
        "confidence": 0.6,
        "status": "ok",
        "energized": false
      },
      {
        "name": "leftHand.majeure",
        "svo": [
          "SVO13"
        ],
        "q_deg": 0,
        "commanded_deg": 2,
        "estimated_deg": 2,
        "sensed_deg": null,
        "provenance": "estimated",
        "confidence": 0.6,
        "status": "ok",
        "energized": false
      },
      {
        "name": "leftHand.ringFinger",
        "svo": [
          "SVO14"
        ],
        "q_deg": 0,
        "commanded_deg": 2,
        "estimated_deg": 2,
        "sensed_deg": null,
        "provenance": "estimated",
        "confidence": 0.6,
        "status": "ok",
        "energized": false
      },
      {
        "name": "leftHand.pinky",
        "svo": [
          "SVO15"
        ],
        "q_deg": 0,
        "commanded_deg": 2,
        "estimated_deg": 2,
        "sensed_deg": null,
        "provenance": "estimated",
        "confidence": 0.6,
        "status": "ok",
        "energized": false
      },
      {
        "name": "leftHand.wrist",
        "svo": [
          "SVO16"
        ],
        "q_deg": 90,
        "commanded_deg": 90,
        "estimated_deg": 90,
        "sensed_deg": null,
        "provenance": "estimated",
        "confidence": 0.6,
        "status": "ok",
        "energized": false
      },
      {
        "name": "leftArm.bicep",
        "svo": [
          "SVO17"
        ],
        "q_deg": 0,
        "commanded_deg": 0,
        "estimated_deg": 0,
        "sensed_deg": null,
        "provenance": "estimated",
        "confidence": 0.6,
        "status": "ok",
        "energized": true
      },
      {
        "name": "leftArm.rotate",
        "svo": [
          "SVO18"
        ],
        "q_deg": 90,
        "commanded_deg": 90,
        "estimated_deg": 90,
        "sensed_deg": null,
        "provenance": "estimated",
        "confidence": 0.6,
        "status": "ok",
        "energized": false
      },
      {
        "name": "leftArm.shoulder",
        "svo": [
          "SVO19"
        ],
        "q_deg": 30,
        "commanded_deg": 30,
        "estimated_deg": 30,
        "sensed_deg": null,
        "provenance": "estimated",
        "confidence": 0.6,
        "status": "ok",
        "energized": true
      },
      {
        "name": "leftArm.omoplate",
        "svo": [
          "SVO20"
        ],
        "q_deg": 10,
        "commanded_deg": 10,
        "estimated_deg": 10,
        "sensed_deg": null,
        "provenance": "estimated",
        "confidence": 0.6,
        "status": "ok",
        "energized": true
      },
      {
        "name": "head.neck",
        "svo": [
          "SVO21"
        ],
        "q_deg": 90,
        "commanded_deg": 90,
        "estimated_deg": 90,
        "sensed_deg": null,
        "provenance": "estimated",
        "confidence": 0.6,
        "status": "ok",
        "energized": true
      },
      {
        "name": "head.rothead",
        "svo": [
          "SVO22"
        ],
        "q_deg": 90,
        "commanded_deg": 90,
        "estimated_deg": 90,
        "sensed_deg": null,
        "provenance": "estimated",
        "confidence": 0.6,
        "status": "ok",
        "energized": false
      },
      {
        "name": "head.rollNeck",
        "svo": [
          "SVO23",
          "SVO24"
        ],
        "q_deg": null,
        "commanded_deg": null,
        "estimated_deg": null,
        "sensed_deg": null,
        "provenance": "unknown",
        "confidence": 0.0,
        "status": "absent",
        "energized": null
      },
      {
        "name": "head.jaw",
        "svo": [
          "SVO25"
        ],
        "q_deg": 0,
        "commanded_deg": 0,
        "estimated_deg": 0,
        "sensed_deg": null,
        "provenance": "estimated",
        "confidence": 0.6,
        "status": "ok",
        "energized": false
      },
      {
        "name": "head.eyeX",
        "svo": [
          "SVO26"
        ],
        "q_deg": 90,
        "commanded_deg": 90,
        "estimated_deg": 90,
        "sensed_deg": null,
        "provenance": "estimated",
        "confidence": 0.6,
        "status": "ok",
        "energized": false
      },
      {
        "name": "head.eyeY",
        "svo": [
          "SVO27"
        ],
        "q_deg": 90,
        "commanded_deg": 90,
        "estimated_deg": 90,
        "sensed_deg": null,
        "provenance": "estimated",
        "confidence": 0.6,
        "status": "ok",
        "energized": false
      },
      {
        "name": "torso.topStom",
        "svo": [
          "SVO28",
          "SVO29"
        ],
        "q_deg": 90,
        "commanded_deg": 90,
        "estimated_deg": 90,
        "sensed_deg": null,
        "provenance": "estimated",
        "confidence": 0.6,
        "status": "ok",
        "energized": true
      },
      {
        "name": "torso.midStom",
        "svo": [
          "SVO30",
          "SVO31"
        ],
        "q_deg": null,
        "commanded_deg": null,
        "estimated_deg": null,
        "sensed_deg": null,
        "provenance": "unknown",
        "confidence": 0.0,
        "status": "absent",
        "energized": null
      }
    ],
    "quantization": {
      "scheme": "grid+detent",
      "bin_deg": 5,
      "rounding": "nearest_half_up_then_clamp"
    },
    "fault_mask": "0000000000000000000000660000066",
    "health": {
      "limbs": {
        "rightHand": "ok",
        "rightArm": "ok",
        "leftHand": "ok",
        "leftArm": "ok",
        "head": "ok",
        "torso": "ok"
      },
      "modifiers": [],
      "estop": "released",
      "power_rails": {
        "REG1": "on",
        "REG2": "on",
        "REG3": "on",
        "REG4": "on",
        "REG5": "on",
        "REG6": "on"
      }
    },
    "balance_profile": {
      "com_class": "centered",
      "tip_risk": "low",
      "support_note": "Classic InMoov low stomach = pole mount (dossier 5.2). Stand/base footprint not yet defined (OPEN-W5).",
      "motion_allowed": true,
      "reasons": [